ID,Name,Description
229,No inversion/no auxiliaries in main clause yes/no questions,You get the point? You liked India?
230,Doubly filled COMP-position with wh-words,What who has eaten? ‘Who ate what?’
231,Superlative marker most occurring before head noun,The most thing I like is apples ‘The thing I like most is apples’
232,Either order of objects in double object constructions (if both objects are pronominal),He couldn’t give him it; I tan [‘took’] it her back
233,Presence of subject in imperatives,Go you there!
234,Like as a focussing device,"How did you get away with that like? Like for one found five quid, that was like three quid, like two-fifty each."
235,Like as a quotative particle,And she was like “What do you mean?”
